{
  "$schema": "https://json-schema.org/draft/2020-12/schema",
  "$id": "https://cacanode.local/contracts/ai-interview/v1/provider-usage.schema.json",
  "title": "Interview provider usage",
  "type": "object", "additionalProperties": false,
  "required": ["schema_version", "event_id", "event_type", "occurred_at", "tenant_id", "aggregate_id", "usage_id", "session_id", "call_attempt_id", "provider", "capability", "quantity", "unit", "provider_request_id"],
  "properties": {
    "schema_version": {"const": "1.0"}, "event_id": {"type": "string", "format": "uuid"}, "event_type": {"const": "interview.provider.usage"},
    "occurred_at": {"type": "string", "format": "date-time"}, "tenant_id": {"type": "string", "format": "uuid"}, "aggregate_id": {"type": "string", "format": "uuid"},
    "usage_id": {"type": "string", "format": "uuid"}, "session_id": {"type": "string", "format": "uuid"}, "call_attempt_id": {"type": "string", "format": "uuid"},
    "provider": {"enum": ["TWILIO", "CARTESIA", "OPENAI"]}, "capability": {"enum": ["VOICE_CALL", "MEDIA_STREAM", "STT", "TTS", "LLM"]},
    "quantity": {"type": "number", "exclusiveMinimum": 0, "maximum": 1000000000}, "unit": {"enum": ["CONNECTED_SECOND", "AUDIO_SECOND", "CHARACTER", "TOKEN"]},
    "provider_request_id": {"type": ["string", "null"], "minLength": 1, "maxLength": 255}
  }
}
