{
  "schema_version": "1.0",
  "event_id": "1719d879-2a96-541f-a402-eb04e7164d1c",
  "event_type": "interview.provider.usage",
  "occurred_at": "2026-07-23T08:10:02Z",
  "tenant_id": "aaaaaaaa-aaaa-4aaa-8aaa-aaaaaaaaaaaa",
  "aggregate_id": "22222222-2222-4222-8222-222222222222",
  "usage_id": "88888888-8888-4888-8888-888888888888",
  "session_id": "22222222-2222-4222-8222-222222222222",
  "call_attempt_id": "55555555-5555-4555-8555-555555555555",
  "provider": "CARTESIA",
  "capability": "TTS",
  "quantity": 86,
  "unit": "CHARACTER",
  "provider_request_id": "provider-request-1"
}
